
{
    "$schema": "http://json-schema.org/schema#",
    "title": "ICLang HyperScript JSON Schema",
    "type": "object",
    "required":["properties", "processes", "connections"],
    "properties": {
        "comment": {"$ref":"#/difinitions/comment"},
        "properties": {"$ref":"#/difinitions/properties"},
        "processes": {"$ref":"#/difinitions/processes"},
        "connections": {"$ref":"#/difinitions/connections"},
        "inports": {"$ref":"#/difinitions/inports"},
        "exports": {"$ref":"#/difinitions/exports"}
    },
    "difinitions":{        
        "properties":{
            "type":"object",
            "properties":{
                "name":{
                    "type":"string",
                    "required": true
                },
                "description":{
                    "type":"string",
                    "required": true
                }
            }
        },
        "processes":{
            "type":"object"
        },
        "connections":{
            "type":"array",
            "items":{
                "type":"object",
                "required": ["src", "dest"],
                "properties":{
                    "src":{},
                    "dest":{}
                }
            }
        },
        "inports":{
            "type":"array"
        },
        "exports":{
            "type":"array"
        },
        "comment":{
            "type":"string"
        }        
    }
}
